jurisdiction,country_code,small_jurisdiction,unique_id,lat,lon,region,income_group,population,level,year_imp,date_imp,last_update,update_detail,instrument,structure,basis_specific,basis_advalorem,products,carbonates,concentrates,energy_drinks,juice_unsweetened,juice_sweetened,milk_drinks,lcsb,water_unsweetened,exclusions,tiered,basis_tiers,bev,sug,pom,swe,threshold,rate,targeted,health_obj,earmarked,indexed,legislation,url_1
Morocco,MAR,0,MAR,,,MENA,LMIC,37457971,National,2019,2019-12-01,N/I,N/A,Excise,Specific,Volume,N/A,"Lemonades, carbonated or non-carbonated water, mineral water, table water or others,flavored or unflavored",1,1,1,0,0,0,0,1,"Juices, milk-based drinks  ",1,"BEV, SUGAR",1,1,0,0,0,"Carbonated or non-carbonated water, mineral water, table water or other, flavored by addition of  <10% edible fruit juice or its equivalent in concentrated juice, and on lemonades prepared with <6% lemon juice or its equivalent in concentrated juices: MAD 30 per hl on beverages containing 5g/100ml or less of added sugar, MAD 40 per hl on beverages containing between 5g/100ml and 10g per 100ml, and MAD 45 per hl on beverages containing 10g per 100ml or more of added sugar; Carbonated or non-carbonated water, mineral water, table or other waters, flavored by adding 10% or more of edible fruit juice or its equivalent in concentrated juice, and on lemonades prepared with 6% or more of lemon juice or its equivalent in concentrated juice - MAD 10 per hl on beverages containing 5g/100ml or less of added sugar, MAD 12.5 per hl on beverages containing between 5g/100ml and 10g per 100ml, and MAD 15 per hl on beverages containing 10g per 100ml or more of added sugar; MAD 600 per hl on energy drinks with a caffeine content of more than 14.5 mg/100 ml and less than 32 mg/100 ml, with the addition of other stimulating substances such as taurine, glucoronolactone, guarana, ginseng, or any other plant extract, where appropriate)",1,1,0,0,Loi de finances No. 70-19 pour l’année budgétaire 2020.,
Mozambique,MOZ,0,MOZ,,,AFR,LIC,32969518,National,2017,2017-12-28,N/I,N/A,Excise,Specific,Volume,N/A,Sweetened waters under HS2202,1,0,1,0,0,0,1,0,"Unsweetened waters, jucies ",0,N/A,0,0,0,0,0,1 Mt/L on waters containing added sugar or other sweetener under HS heading 2202,1,0,0,0,Lei nº 17-2017 de 28 de Dezembro aprova o Código do Imposto sobre Consumos Especifícos [Law nº 17-2017 of 28 December approves the Tax Code on Specific Consumptions],
Nauru ,NRU,1,NRU,-0.528140948,166.93401,EAP,HIC,12668,National,2007,2007-01-01,N/I,N/A,Import,Ad valorem,N/A,Import value ,"All forms of carbonated and non-carbonated soft drinks containing added sugar, and fruit drinks containing added sugar (but not sugar free or zero sugar soft drinks), all forms of milk and dairy products containing added sugar (but not soy milk or natural milk aud dairy products)",1,1,1,0,1,1,0,0,"Water (carbonated or not), soy milk, unflavoured milk (full cream and light) and drinks sweetened other than with sugar. ",0,N/A,0,0,0,0,0,"30% on soft drinks containing added sugar, including sweetened juice and milk-based drinks, excluding LCSB",1,1,0,0,Customs Tariff Act 1997-2006; Customs Tariff (Amendment) Act 2007; Customs (Rates of Duty) Act 2010; Customs Tariff Schedule 2014,
"Navajo Nation, USA",USA,1,USA8,36.31352286,-109.9617588,NAR,HIC,N/A,State/Province,2015,2015-01-01,2020-12-31,"Extended beyond Dec 2020 and re-authorised as a permanent law.Replaced ""Minimal-to-no-nutritional value food"" with ""Unhealthy food and beverages"". Rate kept at 2%",Sales,Ad valorem,N/A,Retail sale price,"""Unhealthy food and beverages"", including non-alcoholic sweetened beverages, whether sweetened with caloric or non-caloric sweeteners, carbonated or non-carbonated, as well as candy, chips, sweetened baked goods, frozen desserts.",1,1,1,0,1,1,1,0,"Plain milk, yoghurt-based drink, flavored and unflavored water without sweetener, non-dairy milk alternatives",0,N/A,0,0,0,0,0,2% on all SSB and LCSB,1,1,1,N//A,"Healthy Diné Nation Act 2014, as amended through CD-96-20",
Nepal,NPL,0,NPL,,,SAR,LMIC,30547580,National,2002,2002-01-30,2022-01-01,"Rate increased on energy drinks in 2022, from Rs. 36/L to Rs. 50/L",Excise,Specific,Volume,N/A,"SSB under HS 2009, 2202, 1806, 2106",1,1,1,1,1,1,1,0,Plain water ,1,BEV,1,0,0,0,0,"Rs.11/L on fruit and vegetable juices, whether or not containing added sugar or other sweetening matter (HS 2009); Rs. 50/L on energy drinks (HS 2202.99.10); Rs. 14/L on other SSB under HS 2202.99.90; Rs. 20/L on non-alcoholic beer (2202.91.00). ",1,0,0,0,"Excise Duty Act, 2002 as amended by Financial Act, 2021 (2078) and Financial Act, 2022",
"Netherlands, The Kingdom of the",NLD,0,NLD,,,ECA,HIC,17703090,National,1992,1992-12-24,2023-01-01,"Rate increased from €8.83 to €20.20 on 1st Jan 2023. Rate set to increase to €26.13 per hectolitre from 1st January 2024, mineral water to be excluded ",Excise,Specific,Volume,N/A,"Consumption tax on non-alcoholic beverages, including fruit and vegetable juices, mineral water, lemonade, syrups, iced teas, whey drinks, non-alcoholic liquors ",1,1,1,1,1,0,1,1,Milk-based drinks,0,N/A,0,0,0,0,0,"0.09 Euro per L on all non-alcoholic beverages, including SSBs and plain waters",0,0,0,0,Wet op de verbruiksbelasting van alcoholvrije dranken (1992),
New Caledonia,NCL,1,NCL2,-21.30185681,165.7023929,EAP,HIC,17703090,National,2017,2017-04-01,N/I,Blank run' from 1/4/17-30/9/19; Entry into full force 1/10/18,VAT/GST,Ad valorem,N/A,N/A,"All SSB, excluding soy milk (HS 2202.99.90)",1,1,1,1,1,1,1,0,"Plain water (HS 2201), plain unsweetened milk, soy milk",0,N/A,0,0,0,0,0,"10% customs duty (DD) on SSB under HS headings 2202 and 2106 (concentrates and syrups); 5% on juices under HS heading 2009. Imports also subject to 3-6% TSPA (Tax in support of local agricultural production - payable on all imports of agricultural origin) + 22% TGC (General consumption tax). Unsweetened water-based beverages (HS 2201) are exempt from customs duty, TSPA and TGC. ",1,1,0,N /A,"Taxe Générale sur la Consommation, Loi du pays no. 2016-14 du 30 Septembre 2016",
New Caledonia,NCL,1,NCL1,-21.30185681,165.7023929,EAP,HIC,N/A,National,2017,2017-04-01,N/I,N/A,Import,Ad valorem,N/A,Import value ,"SSB under HS2202, 2009, 2106",1,1,1,1,1,1,1,0,"Unsweetened water (carbonated or not), soy milk; All products of EU origin",0,N/A,0,0,0,0,0,"22% (highest tier of TGC - General Consumption Tax) on 'sugary drinks' under HS 2202, 2106, 2009",1,0,0,N/A,"New Caledonia Customs Code (updated 2021); Délibération n° 208 du 14 janvier 2022 portant tarif des douanes de Nouvelle-Calédonie et portant diverses dispositions d’ordre fiscal; Taxe Générale sur la Consommation, Loi du pays no. 2016-14 du 30 Septembre 2016",
"Newfoundland and Labrador, Canada",CAN,1,CAN1,52.94232849,-58.36740133,NAR,HIC,N/A,State/Province,2022,2022-09-01,N/I,N/A,Excise,Specific,Volume,N/A,"SSB, including sweetened fruit-flavored juices, sweetened iced tea and lemonades, sweetened sports and energy drinks,and dispensed beverages such as sweetened soda fountain drinks",1,1,1,0,1,0,0,0,"100% juices, milk-based drinks, sweetened dairy alternatives, yoghurt drinks, LCSB, plain water",0,N/A,0,0,0,0,0,"CAD$0.20/L on ready-to-drink beverages to which the manufacturer has added sugar such as regular soft-drinks, sweetened fruit-flavoured juices, sweetened iced-tea and lemonades, sweetened sports and energy drinks, and dispensed beverages such as sweetened soda fountain drinks, slush drinks and fruit juices. $0.20 per litre (based on manufacturer's recommended mixing ratios for finished product) on concentrated drink mixtures, including frozen concentrated sweetened fruit punches, sweetened flavoured drink crystals and powders, and flavoured syrups to which the manufacturer has added sugar. These also include concentrates used to produce dispensed beverages (e.g. post-mix).Where the manufacturer does not provide sufficient directions for finished beverage preparation and/or volume:
$0.80 per litre for frozen concentrated juices,
$2.00 per kilogram for flavoured powders, and
$1.20 per litre for syrups.",1,1,0,0,"Sugar Sweetened Beverage Tax (SSBT), Regulation 60/21 of 28th October 2021, Amendment to Revenue Administraction Act ",
Nicaragua ,NIC,0,NIC,,,LAC,LMIC,6948392,National,2019,2021-01-01,"Rate increased 2020, 2021",N/A,Excise,Ad valorem,N/A,Retail sale price,"All non-alcoholic beverages, sweetened or not-sweetened, carbonated or not",1,1,1,1,1,1,1,1,None,0,N/A,0,0,0,0,0,15% on all non-alcoholic beverages,0,0,0,N/A,"Ley de Concertación Tributaria N 987, 2019",
Niger,NER,0,NER,,,AFR,LIC,26207977,National,2015,2015-05-27,N/I,N/A,Excise,Ad valorem,N/A,Ex-factory or CIF value,"Non-alcoholic beverages, including fruit juice (HS headings 2202 and 2009), excluding water; Extracts, essences or concentrates of tea and coffee (HS2101)",1,1,1,1,1,1,1,0,Plain water,1,BEV,1,0,0,0,0,"15% on non-alcoholic beverages under HS heading 2202.10 and HS 22.02.90, 10% on extracts, essences and concentrates of tea and coffee (HS 21.01)",1,0,0,N/A,Loi no. 2019-76 du 31 décembre 2019 portant loi de finances pour l´année budgétaire 2020; Loi 2015-38 modifiant la Code Général des Impôts,
Nigeria,NGA,0,NGA,,,AFR,LMIC,218541212,National,2021,2021-12-31,N/I,N/A,Excise,Specific,Volume,N/A,Non-alcoholic carbonated and sugar-sweetened beverages,1,0,1,0,0,0,1,0,Unsweetened and non-carbonated beverages,0,N/A,0,0,0,0,0,"NGN 10/L on non-alcoholic, carbonated and sugar-sweetened beverages",1,1,0,0,"Finance Act 2021, amending the Customs, Excise Tariffs, etc (Consolidated) Act, 2004 (“CETA”); Excise Duty (Non-Alcoholic, Carbonated and Sweetened Beverages) Regulations, 2022",
Niue,NIU,1,NIU,-19.05215294,-169.8584662,EAP,N/C,N/A,National,1969,1969-01-01,2016-07-01,Rate increased from 60% to 80% in 2016,Import,Ad valorem,N/A,Import value ,Sweetened beverages (HS2202) excluding flavored water and flavored milk,1,0,1,0,0,0,1,0,"Plain water, flavored water, flavored milk",0,N/A,0,0,0,0,0,"80% on sweetened beverages under HS2202, excluding flavored water and flavored milk",1,1,0,N/A,Customs Tariff Order 1969; Customs Tariff Act 1982; Customs and Tariff (General Amendment) Regulations 2016,
Northern Mariana Islands,MNP,1,MNP,15.83184335,145.6131105,EAP,HIC,49551,National,1995,1995-01-01,N/I,N/A,Excise,Specific,Volume,N/A,"Soft drinks, meaning ""any readily drinkable carbonated or non-carbonated nonalcoholic beverage, other than drinkable dairy products, 100% fruit or vegetable juices, and bottled drinking water""",1,0,1,0,1,0,1,0,"Milk-based drinks, water, 100% juices",0,N/A,0,0,0,0,0,"US$0.005 per fl oz on nonalcoholic beverages, excluding milk-based drinks, 100% fruit or vegetable juices, and unsweetened water",1,0,0,0,"Public Law No. 9-22, Ch 4, Art 2, 1994 ",
"Oakland, USA",USA,1,USA4,39.3064323,-122.2725454,NAR,HIC,N/A,City/County,2017,2017-07-01,N/I,N/A,Excise,Specific,Volume,N/A,"Any beverage to which one or more caloric sweeteners have been added and that contain ≥25 kcals per 12 fluid ounces of beverage and include sodas, sports drinks, sweetened teas, and energy drinks ",1,1,1,0,1,0,0,0,"Milk-based drinks, LCSB, 100% fruit and/or vegetable juice ",0,N/A,0,0,0,0,1,"US¢1 per ounce on any beverage to which one or more caloric sweeteners have been added and that contain ≥25 kcals per 12 fluid ounces of beverage, excluding milk-based drinks",1,1,1,0,"Ord No. 86161, Sugar Sweetened Beverage Product Distribution Tax",
Oman ,OMN,0,OMN,,,MENA,HIC,4576298,National,2019,2019-06-15,2020-10-01,Rate increased and extended to cover all SSB in 2020 (previously applied only to carbonated and energy drinks),Excise,Ad valorem,N/A,Ex-factory or CIF value,"All types of juices, sports drinks, fruit/malt syrups, pre-mixed ready to serve coffee and tea drinks, which “contains sugar or any of its derivatives” (regardless of the percentage of sugar contained). Concentrates, powders, gels, extracts or “any other forms” that can be converted into sweetened drinks.",1,1,1,0,1,0,1,0,"Unsweetened waters, 100% juice, milk and other dairy products that contain at least 75% milk ",1,BEV,1,0,0,0,0,"50% on all ready-to-drink beverages that contain added sugar or other sweeteners as well as concentrates, powder, gel, or extracts intended to be made into an SSB; 100% on energy drinks",1,1,0,N/A,National Excise Tax Law Decree 23/2019,
Pakistan,PAK,0,PAK,,,SAR,LMIC,235824862,National,2005,2005-07-01,2023-03-01,"Federal Excise Duty (FED) rate on carbonated beverages increased from 8% to 13% in 2019. FED on juices withdrawn in 2021. FED on flavored milk and yoghurt-based drinks increased from 10% to 17% in 2022. FED on carbonated beverages increased to 20% and 10% FED imposed on fruit juices, syrups, and squashes, and waters whether or not containing added sugar or artificial sweeteners excluding mineral and aerated water on 1 March 2023. ",Excise,Ad valorem,N/A,Ex-factory or CIF value,"Waters whether or not containing added sugar or artificial sweeteners excluding mineral water; flavored milk and yoghurt; sugary fruit juices, syrups and squashes",1,1,1,1,1,1,1,1,None,1,BEV,1,0,0,0,0,"20% on aerated waters containing added sugar or other sweetening matter or flavored; 17% on flavored milk and yoghurt-based drinks; 10% on fruit juices, syrups and squashes, and waters whether or not containing added sugar or artificial sweeteners excluding mineral and aerated water",0,0,0,N/A,"Federal Excise Act, 2005; Finance Supplementary Act, 2023",
Palau,PLW,1,PLW,7.3663307,134.4340941,EAP,UMIC,18055,National ,2003,2003-09-01,N/I,N/A,Import,Mixed,Volume,Import value ,"Carbonated soft drinks under HS heading 2202, bottled water ",1,0,1,0,0,0,1,1,"Juices, non-carbonated SSB",0,N/A,0,0,0,0,0,$0.10 per 12 fl. oz. on carbonated soft drinks under HS2202; 25% ad valorem on bottled water,0,0,0,0,"Palau National Code, Title 40, Chapter 13, § 1301 - Imposition of import tax; Palau Customs Tariff Schedule HS2012",
Panama,PAN,0,PAN,,,LAC,HIC,4408581,National,1995,1995-11-14,2019-11-18,Rates increased in 2019 ,Excise,Ad valorem,N/A,Retail sale price,Nonalcoholic beverages containing added sugar or sweeteners and concentrated syrups,1,1,1,0,1,0,1,0," Dairy, grain, and cereal-based beverages, natural fruit juices and concentrates, or products with <7.5 g sugar per 100 ml",1,BEV,1,0,0,0,0,7% on carbonated SSB; 5% on other nonalcoholic SSB; 10% on syrups and concentrates used to produce sugary drinks,1,0,0,N/A,"Ley N 45, 14 nov 1995; Ley N 114 of 18 nov 2019",
Paraguay,PRY,0,PRY,,,LAC,UMIC,6780744,National,1992,1992-01-09,2015-12-01,"Rate lowered from 8% to 5% in Dec 2015. Proposal to increase rate to 20% presented to Congress in 2018, not passed. ",Excise,Ad valorem,N/A,Ex-factory or CIF value,Soda and beverages - sweetened or not - without alcohol or with a maximum of 2 percent alcohol; juice of fruits with a maximum of 2 percent alcohol,1,1,1,1,1,1,1,1,None,0,N/A,0,0,0,0,0,5% on all non-alcoholic beverages,0,0,0,N/A,Ley N 5538/15; Ley N 125/91,
Peru ,PER,0,PER,,,LAC,UMIC,34049588,National,1999,1999-04-15,2021-09-01,"From April 1999 to Dec 2006, 19% applied to consumption of specific ""luxury"" goods, including carbonated soda and bottled water (carbonated and non-carbonated) . On 29 Dec 2006, bottled water was made exempt from the ISC, and non-carbonated soft drinks, energy drinks, and sports drinks were added to the list of products covered by the tax . All dairy-based drinks and juices remained exempt. In May 2018, rate increased from 17% to 25% on all SSB (including non-alcoholic beer) containing 6g sugar or more per 100 ml. In June 2019, rate lowered from 17% to 12%  for SSBs containing 0.5 g sugar or less per 100 ml. In Sept 2021, upper threshold was lowered to 5 grams sugar/100ml. ",Excise,Ad valorem,N/A,Retail sale price,"Nonalcoholic beverages, sweetened waters, and 0% alcohol beer ",1,1,1,1,1,1,1,0,"Plain water, 100% juice, plain milk, drinkable yoghurts (incl. sweetened)",1,SUGAR  ,0,1,0,0,0,"25% on beverages with ≥6 g sugar per 100 ml, 17% on drinks with 0.5-6g sugar per 100ml, 12% on drinks with <0.5g sugar per 100ml. Applies to all sweetened beverages excluding drinkable yoghurts and 100% juice",1,1,0,N/A,"Impuesto Selectivo al Consumo (ISC) introduced by Titulo II - Decreto Supremo N 055-99-EF, April, 15, 1999; Decreto Supremo 216-2006-EF; Decreto Supremo N 091-2018-EF, 9 May 2018; Supreme Decree 266-2021-EF",
"Philadelphia, USA",USA,1,USA5,39.95178632,-75.16823173,NAR,HIC,N/A,City/County,2017,2017-07-01,N/I,N/A,Excise,Specific,Volume,N/A,"Any nonalcoholic beverage with caloric sugar-based sweetener or artificial sugar substitute listed as an ingredient, including soda, non-100% fruit and vegetable drinks, sports drinks, flavored water, energy drinks, pre-sweetened coffee or tea, and nonalcoholic beverages intended to be mixed into an alcoholic drink; also, syrups or other concentrates used in beverages (incl. coffee syrups distributed to coffee shops), pre-packaged beverages made with “natural” sweeteners, such as agave, honey, or stevia. Any non-alcoholic beverage that lists as an ingredient:  any form of caloric sugar-based sweetener, including, but not limited to, sucrose, glucose or high fructose corn syrup; or  any form of artificial sugar substitute, including stevia, aspartame, sucralose, neotame, acesulfame potassium (Ace-K), saccharin, and advantame.  Any non-alcoholic syrup or other concentrate that is intended to be used in the preparation of a beverage and that lists as an ingredient: any form of caloric sugar-based sweetener, including, but not limited to, sucrose, glucose or high.fructose corn syrup; or  any form of artificial sugar substitute, including stevia, aspartame, sucralose, neotame, acesulfame potassium (Ace-K), saccharin,  and advantame.",1,1,1,0,1,0,1,0,"Milk-based drinks, 100% fruit and/or vegetable juices",0,N/A,0,0,0,0,0,"US¢1.5 per ounce on all nonalcoholic beverages containing caloric sugar-based sweetener or artificial sugar substitute, including soda, non-100% fruit and vegetable drinks, sports drinks, flavored water, energy drinks, pre-sweetened coffee or tea, concentrtes, and nonalcoholic beverages intended to be mixed into an alcoholic drink.",1,1,1,0,"Sugar Sweetened Beverage Tax, Bill No. 160176",
Philippines ,PHL,0,PHL,,,EAP,LMIC,115559009,National,2018,2018-01-01,N/I,N/A,Excise,Specific,Volume,N/A,"Beverages made with caloric and non-caloric sweeteners, including sweetened juice drinks, sweetened tea, all carbonated beverages, flavoured water,energy and sports drinks, powdered drinks not classified as milk, juice, tea or coffee, cereal and grain beverages, and other non-alcoholic beverages that contain added sugar.
",1,1,1,0,1,0,1,0,"All milk products whether sweetened or not, including plain milk, infant formula milk, follow-on milk, growing-up milk, powdered milk, ready-to-drink milk, flavoured milk, fermented milk, soy milk and flavoured soy milk;100% natural fruit and vegetables juices without added sugar or caloric sweeteners; meal-replacement and medically indicated beverages; ground coffee, instant soluble coffee and prepackaged powdered coffee products; and beverages sweetened with coconut sap or stevia glycosides.",1,SWE,0,0,0,1,0,"PHP 6 per liter on drinks containing sugar and artificial sweeteners; PHP 12 per liter on drinks containing HFCS, excluding milk-based drinks and 100% juices",1,1,0,0," Tax Reform for Acceleration and Inclusion (TRAIN) Law, Republic Act No. 10963 of 24th July 2017",
Poland,POL,0,POL,,,ECA,HIC,37561599,National,2021,2021-01-01,N/I,N/A,Excise,Specific,Sugar+Volume,N/A,"Non-alcoholic drinks containing added sugar or artificial sweeteners, caffeine or taurine",1,1,1,0,1,1,1,0,"Sports/isotonic drinks with sugar content less than or equal to 5g sugar/100mL, juice products with content of no less than 20 per cent of fruit or vegetable juice with max. sugar content of 5 g/100 ml, and beverages with milk or milk products as the first/primary ingredient are exempt. Juice drinks with at least 20% juice content and isotonic sports drinks that exceed the sugar limit (of 5g sugar/100mL) are not charged the base fee of PLN 0.5 per L.",1,"BEV, SUGAR",1,1,0,0,0,PLN 0.50 per liter on drinks containing <5g sugar per 100ml. Additional PLN 0.05 per gram of sugar >5g/100ml. Additional PLN 0.09 per L on drinks containing caffeine or taurine. Total soda fee cannot exceed PLN 1.2 per L. ,1,1,0,0,Ustawa z dnia 14 lutego 2020 r. o zmianie niektórych ustaw w związku z promocją prozdrowotnych wyborów konsumentów [Amending certain acts in connection with the promotion of health-promoting choices of consumers],
Portugal,PRT,0,PRT,,,ECA,HIC,10379007,National,2017,2017-01-01,N/I,N/A,Excise,Specific,Volume,N/A,"Mineral, flavored, and aerated waters containing added sugar or sweeteners",1,1,1,0,1,0,1,0,"100% juice, milk, dairy alternatives",1,SUGAR  ,0,1,0,0,0,8.22€/hl on SSB containing <80 g sugar/l; 16.46€/hl on SSB containing  ≥80 g sugar/l. Applies to beverages under HS 2202 and concentrates,1,1,1,0,"Diário da República nº 248/2016 Série I de 2016-12-28. Lei 42/2016. Orçamento do Estado para 2017. Secção III. Impostos especiais de consumo. Artigo 211. Imposto sobre o álcool, as bebidas alcoólicas e as bebidas adicionadas de açúcar ou outros edulcorantes (IABA). 2016 Dec 28. Artigo 247.º do/a Lei n.º 114/2017 - Diário da República n.º 249/2017, Série I de 2017-12-29, em vigor a partir de 2018-01-01. Lei n.º 24-D/2022, de 30 de dezembro",
Qatar,QAT,1,QAT,25.28084111,51.19245044,MENA,HIC,2695122,National,2019,2019-01-01,N/I,N/A,Excise,Ad valorem,N/A,Retail sale price," Any aerated beverage (except unflavoured aerated water) such as carbonated water with added sugar, other sweeteners or flavours. Also includes concentrates, powder, gel or extracts intended to be made into an aerated beverage",1,1,1,0,0,0,1,0,"Non-flavored aerated water, non-carbonated sweetened beverages, coffee and tea",1,BEV,1,0,0,0,0,50% on carbonated sweetened drinks and concentrates intended to be made into carbonated drinks; 100% on energy drinks ,1,1,0,N/A,Law No. 25 of 2018 concerning excise tax,
Romania,ROU,0,ROU,,,ECA,HIC,18956666,National,2023,2023-01-01,N/I,N/A,VAT/GST,Ad valorem,N/A,N/A,"Beverages under HS headings 2202 10, and 2202 99",1,0,1,0,0,0,1,0,"Juices, milk, unsweetened waters",0,N/A,0,0,0,0,0,"19% (standard VAT rate) on beverages under HS headings 2202 10, and 2202 99. Reduced rate (9%) previously applied. ",1,1,0,0,"ORDONANŢĂ nr. 16 din 15 iulie 2022 pentru modificarea şi completarea Legii nr. 227/2015 privind Codul fiscal (Government Ordinance no. 16/2022 (art. 93) of 15 July 2022, amending Law no. 227/2015 regarding the Fiscal Code, published in Official Gazette no. 716/15 VII 2022 ",
Russian Federation,RUS,0,RUS,,,ECA,UMIC,143555736,National ,2023,2023-07-01,N/I,N/A,Excise,Specific,Volume,N/A,"Drinks sweetened with added sugar, sugar syrup, or honey, with sugar content > 5g per 100ml",1,1,1,0,0,0,0,0,"Juices, juice-containing drinks, nectars, fruit drinks, syrups, milk, dairy products, jelly and (or) plant-based drinks made from cereal grains, legumes, oilseeds, nuts, coconut and (or) products of their processing, with the exception of tonic drinks and drinks that contain carbon dioxide as a component; Drinks with added sugar < 5g per 100ml",0,N/A,0,0,0,0,1,"7 rubles per liter on drinks sweetened with added sugar, sugar syrup, or honey, with sugar content > 5g per 100ml, excluding juice- and milk-based drinks",1,1,1,0,"Order No. ED-7-3/262@ dated 04/19/2023, Amending the Tax Code of the Russian Federation - Налоговый кодекс Российской Федерации (НК РФ), Глава 22, Статья 181 и Статья 193 ( Chapter 22 “Excises”, Art. 181, para 1, subpara 23, and Art. 193, para 1, subpara 40)",
Rwanda,RWA,0,RWA,,,AFR,LIC,13776698,National,2019,2019-09-13,N/I,N/A,Excise,Ad valorem,N/A,Ex-factory or CIF value,"Lemonade, soda, juices",1,1,1,1,1,1,1,1,None,1,BEV,1,0,0,0,0,"39% on lemonade, soda and other non-natural juices, 10% on industrial packed mineral water, 5% on natural fruit and vegetable juices",0,0,0,N/A,Law No. 025/2019 of 13/9/2019 establishing the Excise Duty,
Saint Helena,SHN,1,SHN,-25.32020155,-10.40903589,AFR,N/C,N/A,National,2014,2014-01-01,2018-01-01,"Rate increased from ₤0.75 per liter to ₤1.00 per liter in 2018, base extended to include fruit juice",Excise,Specific,Volume,N/A,"Carbonated beverages, juices, and concentrates containing ≥15 g per liter sugar",1,1,1,1,1,0,0,0,"All drinks containing less than 15g sugar per liter, including LCSBs, plain water",0,N/A,0,0,0,0,1,"₤1.00 per liter on carbonated beverages, juices, and concentrates containing ≥15 g sugar per liter ",1,1,0,0,"Customs & Excise (Tariffs) (Amendment) Regulations, 2018",
Saint Kitts and Nevis ,KNA,1,KNA,17.27372785,-62.70333699,LAC,HIC,47657,National,2010,2010-10-26,N/I,N/A,Excise,Ad valorem,N/A,Retail sale price,"Waters, including mineral waters and aerated waters, containing added sugar or other sweetening matter or flavoured (HS 2202), and other nonalcoholic beverages, not including fruit or vegetable juices of heading 20.09; Beverages containing cocoa and malt beverages (HS 2202.90)",1,0,1,0,0,1,1,0,"Plain water, juices (HS 2009)",0,N/A,0,0,0,0,0,"5% on waters, including mineral waters and aerated waters, containing added sugar or other sweetening matter or flavoured under HS heading 2202",1,0,0,N/A,"Excise Tax Act No. 4, 2010",
